"record_id","modified","institutionCode","collectionCode","catalogNumber","basisOfRecord","kingdom","family","genus","specificEpithet","scientificName","scientificNameAuthorship","identifiedBy","yearIdentified","monthIdentified","dayIdentified","recordedBy","recordNumber","year","month","day","country","stateProvince","county","locality","occurrenceRemarks","barcode","imagecode","phylum","class","order"
"1","2020-03-10 08:26:39-03","UFV","VIC","6478","PreservedSpecimen","Plantae","Amaranthaceae","Amaranthus","lividus","Amaranthus lividus","L.","Coons, M.P.","1978","12","11","Coons, M.P.","462","1978","05","22","Brasil","Minas Gerais","Amparo da Serra","Ao lado de casa.","Erva de aproximadamente 0,50 cm de altura. Caule meio suculento. Flores verdes. Comum como invasora.","VIC006478","VIC006478",NA,NA,NA
"2","2020-03-10 08:26:40-03","UFV","VIC","6599","PreservedSpecimen","Plantae","Amaranthaceae","Amaranthus","spinosus","Amaranthus spinosus","L.","Coons, M.P.","1978","05","22","Coons, M.P.","s.n.","1978","05","22","Brasil","Minas Gerais","Amparo da Serra","Ao lado de uma casa.","Comum como invasora. Caule avermelhado, com até 1,0 metro de altura.","VIC006599","VIC006599",NA,NA,NA
"3","2020-03-10 08:28:02-03","UFV","VIC","30269","PreservedSpecimen","Plantae","Capparaceae",NA,NA,NA,NA,NA,NA,NA,NA,"Souza, A.N. de","01","2006","04","18","Brasil","Minas Gerais","Amparo da Serra","Fazenda Souza, À 6 km da cidade - 15 km da estrada da casa.","Subarbusto de flor rosa e branca, fruto verde, presença de espinhos em ramos. Presença de abelhas. Frequente na região.","VIC030269","VIC030269",NA,NA,NA
"4","2020-03-10 08:27:28-03","UFV","VIC","21302","PreservedSpecimen","Plantae","Bignoniaceae","Fridericia","speciosa","Fridericia speciosa","Mart.","Valente, G.E.","2005","03","15","Valente, G.E.; Costa, C.A. da","1660","2005","03","15","Brasil","Minas Gerais","Amparo da Serra","Rodovia de acesso à Amparo da Serra, À 6,0 km antes de chegar à cidade. Em barranco de beira de estrada.","Liana. Gavinhas emergindo entre os dois folíolos. Cálice e corola rosa e fruto amarronzado.","VIC021302","VIC021302",NA,NA,NA
"5","2020-03-10 08:30:17-03","UFV","VIC","48922","PreservedSpecimen","Plantae","Poaceae","Merostachys","tatianae","Merostachys tatianae","Santos-Gonç., Carv.-Okano & Filg.","Vinícius-Silva, R.","2015","12","26","Vinícius-Silva, R.; Silva, L.C.","63","2015","12","26","Brasil","Minas Gerais","Amparo da Serra","Rodovia Amparo da Serra-Ponte Nova (AMG 1740), Aproximadamente 2 Km a partir de Amparo da Serra em direção à BR-120 (BR entre Teixeiras e Ponte Nova)","Indivíduos com, aproximadamente, 10 m de altura, inicialmente eretos e, posteriormente, inclinando sobre a vegetação adjacente. Entrenós e folhas do colmo coberto por tricomas híspidos e urentes.","VIC048922","VIC048922",NA,NA,NA
"6","2020-03-10 08:26:36-03","UFV","VIC","26341","PreservedSpecimen","Plantae","Acanthaceae","Thunbergia","alata","Thunbergia alata","Bojer ex Sims",NA,NA,NA,NA,"Amora, D.X.","s.n.","2002","02","14","Brasil","Minas Gerais","Amparo da Serra","Na estrada para o Sítio Amora, na encosta do barranco, perto da porteira.","Planta trepadeira, flores de corola amarela com tubo vináceo, frequentemente no local. Não se observou a presença de animais e de frutos na planta.","VIC026341","VIC026341",NA,NA,NA
"7","2019-11-29 15:05:05-03","UEFS","HUEFS","253422","PreservedSpecimen","Plantae","Poaceae","Merostachys","tatianae","Merostachys tatianae","Santos-Gonç., Carv.-Okano & Filg.",NA,NA,NA,NA,"Vinícius-Silva, R.","63","2015","12","16","Brasil","Minas Gerais","Amparo da Serra","Rodovia Amparo da Serra-Ponte Nova (AMG 1740), aproximadamente 2 Km a partir de Amparo da Serra em direção à BR-120 (BR entre Teixeiras e Ponte Nova).",NA,"HUEFS0253422",NA,"Angiospermae","Lilianae","Poales"
